A1: Order | B1: Name | C1: 2001 OPS | D1: Career OPS
A2: 3 | B2: Arod | C2: 1.0209999999999999 | D2: 0.94899999999999995
A3: 5 | B3: Gonzalez | C3: 00.96 | D3: 0.91300000000000003
A4: 4 | B4: Palmeiro | C4: 0.94399999999999995 | D4: 0.89200000000000002
A5: 2 | B5: Irod | C5: 0.88800000000000001 | D5: 0.82599999999999996
B6: Sierra | C6: 0.88400000000000001 | D6: 0.77200000000000002
A7: 1 | B7: Catalanotto | C7: 0.88200000000000001 | D7: 0.82599999999999996
A8: 7 | B8: Greer | C8: 0.79500000000000004 | D8: 0.872
B9: Kapler | C9: 0.78500000000000003 | D9: 0.78900000000000003
A10: 6 | B10: Everett | C10: 0.76100000000000001 | D10: 0.82599999999999996
A11: 8 | B11: Lamb | C11: 00.76 | D11: 0.72299999999999998
A12: 9 | B12: Young | C12: 0.69899999999999995 | D12: 0.69899999999999995
B13: Ledee | C13: 0.65400000000000003 | D13: 00.72
A15: SP | B15: Park | C15: 0.66300000000000003 | D15: 00.67
B16: Valdes | C16: 0.77900000000000003 | D16: =AVERAGE(C16,0.744,0.698) -> 0.7403333333333334
B17: Burba | C17: 0.83099999999999996 | D17: 00.76
B18: Davis* | C18: 0.78500000000000003 | D18: 0.81699999999999995
B19: Rogers* | C19: 0.875 | D19: 0.78686363636363632
B20: Irabu | C20: 0.83799999999999997 | D20: =AVERAGE(C20,0.91,0.75) -> 0.83266666666666678
A21: x | B21: Woodard | C21: 0.84399999999999997 | D21: =AVERAGE(C21,0.801,0.801,0.906) -> 0.83800000000000008
B22: Helling | C22: 0.876 | D22: =AVERAGE(C22,0.78,0.84) -> 0.83199999999999996
A23: x | B23: Myette | C23: 0.873 | D23: 0.86099999999999999
B24: Oliver | C24: 0.88100000000000001 | D24: =AVERAGE(C24,0.74,0.95) -> 0.85699999999999987
A25: x | B25: Bell | C25: 00.95 | D25: 0.88200000000000001
A27: RP | B27: Seanez | C27: =0.288+0.275 -> 0.56299999999999994 | D27: =AVERAGE(C27,0.615,0.605) -> 0.59433333333333327
B28: Moreno* | C28: 0.59699999999999998 | D28: 0.59699999999999998
B29: Zimmerman | C29: 0.59499999999999997 | D29: 0.63800000000000001
B30: Rocker* | C30: 00.71 | D30: =AVERAGE(C30,0.68,0.62,0.552) -> 0.64050000000000007
B31: Venafro* | C31: 0.69299999999999995 | D31: 0.69899999999999995
B32: Van Poppell | C32: 0.70599999999999996 | D32: =AVERAGE(C32,0.752) -> 0.72899999999999998
A33: x | B33: Miceli | C33: 0.73499999999999999 | D33: =AVERAGE(C33,0.666,0.765) -> 0.72199999999999998
B34: Powell | C34: 00.73 | D34: =AVERAGE(C34,0.75,0.74) -> 00.74
A35: x | B35: Kolb | C35: 0.74099999999999999 | D35: 0.747
A36: x | B36: Carrasco | C36: 0.77600000000000002 | D36: =AVERAGE(C36,0.875,0.768) -> 0.80633333333333335
B37: Mahomes | C37: 0.872 | D37: =AVERAGE(C37,0.69,0.847) -> 0.80299999999999994
B38: Petkovsek | C38: 0.90600000000000003 | D38: =AVERAGE(C38,0.691,0.751) -> 0.78266666666666662
B39: Crabtree | C39: 1.030 | D39: =AVERAGE(C39,0.714,0.715) -> 0.81966666666666665