B1: Texas Rangers

A1: Player | B1: G | C1: AB | D1: R | E1: H | F1: 2B | G1: 3B | H1: HR | I1: RBI | J1: TB | K1: BB | L1: SO | M1: SB | N1: CS | O1: OBP | P1: SLG | Q1: OPS
A2: H Blalock | B2: 6 | C2: 26 | D2: 2 | E2: 6 | F2: 1 | G2: 0 | H2: 1 | I2: 2 | J2: 10 | K2: 2 | L2: 5 | M2: 0 | N2: 0 | O2: 0.28599999999999998 | P2: 0.38500000000000001 | Q2: =O2+P2 -> 0.67100000000000004
A3: M Teixeira | B3: 6 | C3: 25 | D3: 6 | E3: 5 | F3: 0 | G3: 0 | H3: 2 | I3: 4 | J3: 11 | K3: 0 | L3: 6 | M3: 0 | N3: 0 | O3: 0.23100000000000001 | P3: 0.440 | Q3: =O3+P3 -> 0.67100000000000004
A4: D Glanville | B4: 6 | C4: 24 | D4: 1 | E4: 5 | F4: 1 | G4: 0 | H4: 0 | I4: 1 | J4: 6 | K4: 1 | L4: 3 | M4: 1 | N4: 0 | O4: 0.240 | P4: 0.250 | Q4: =O4+P4 -> 0.490
A5: M Young | B5: 6 | C5: 24 | D5: 4 | E5: 11 | F5: 1 | G5: 1 | H5: 1 | I5: 3 | J5: 17 | K5: 1 | L5: 2 | M5: 0 | N5: 0 | O5: 0.480 | P5: 0.70799999999999996 | Q5: =O5+P5 -> 1.1879999999999999
A6: C Everett | B6: 5 | C6: 22 | D6: 2 | E6: 5 | F6: 0 | G6: 0 | H6: 1 | I6: 2 | J6: 8 | K6: 0 | L6: 7 | M6: 0 | N6: 0 | O6: 0.22700000000000001 | P6: 0.36399999999999999 | Q6: =O6+P6 -> 0.59099999999999997
A7: A Rodriguez | B7: 6 | C7: 22 | D7: 1 | E7: 5 | F7: 1 | G7: 0 | H7: 0 | I7: 0 | J7: 6 | K7: 3 | L7: 5 | M7: 0 | N7: 0 | O7: 0.320 | P7: 0.27300000000000002 | Q7: =O7+P7 -> 0.59299999999999997
A8: K Mench | B8: 5 | C8: 18 | D8: 1 | E8: 6 | F8: 3 | G8: 0 | H8: 1 | I8: 3 | J8: 12 | K8: 2 | L8: 5 | M8: 0 | N8: 0 | O8: 0.400 | P8: 0.66700000000000004 | Q8: =O8+P8 -> 1.0670000000000002
A9: R Palmeiro | B9: 6 | C9: 18 | D9: 3 | E9: 7 | F9: 0 | G9: 0 | H9: 1 | I9: 2 | J9: 10 | K9: 5 | L9: 1 | M9: 0 | N9: 0 | O9: 0.52200000000000002 | P9: 0.55600000000000005 | Q9: =O9+P9 -> 1.0780000000000001
A10: E Diaz | B10: 5 | C10: 17 | D10: 1 | E10: 6 | F10: 1 | G10: 0 | H10: 0 | I10: 5 | J10: 7 | K10: 0 | L10: 2 | M10: 0 | N10: 0 | O10: 0.316 | P10: 0.41199999999999998 | Q10: =O10+P10 -> 0.72799999999999998
A11: J Gonzalez | B11: 2 | C11: 8 | D11: 5 | E11: 5 | F11: 0 | G11: 0 | H11: 1 | I11: 3 | J11: 8 | K11: 0 | L11: 2 | M11: 0 | N11: 0 | O11: 0.625 | P11: 1.000 | Q11: =O11+P11 -> 1.625
A12: T Greene | B12: 1 | C12: 4 | D12: 0 | E12: 1 | F12: 1 | G12: 0 | H12: 0 | I12: 0 | J12: 2 | K12: 0 | L12: 0 | M12: 0 | N12: 0 | O12: 0.250 | P12: 0.500 | Q12: =O12+P12 -> 0.750
A13: D Sadler | B13: 3 | C13: 4 | D13: 0 | E13: 3 | F13: 0 | G13: 0 | H13: 0 | I13: 0 | J13: 3 | K13: 0 | L13: 0 | M13: 0 | N13: 1 | O13: 0.750 | P13: 0.750 | Q13: =O13+P13 -> 1.500
A14: I Valdes | B14: 1 | C14: 2 | D14: 0 | E14: 0 | F14: 0 | G14: 0 | H14: 0 | I14: 0 | J14: 0 | K14: 0 | L14: 0 | M14: 0 | N14: 0 | O14: 0.000 | P14: 0.000 | Q14: =O14+P14 -> 0.000
A15: M Lamb | B15: 1 | C15: 1 | D15: 0 | E15: 0 | F15: 0 | G15: 0 | H15: 0 | I15: 0 | J15: 0 | K15: 0 | L15: 0 | M15: 0 | N15: 0 | O15: 0.000 | P15: 0.000 | Q15: =O15+P15 -> 0.000
A16: F Cordero | B16: 1 | C16: 0 | D16: 0 | E16: 0 | F16: 0 | G16: 0 | H16: 0 | I16: 0 | J16: 0 | K16: 0 | L16: 0 | M16: 0 | N16: 0 | O16: 0.000 | P16: 0.000 | Q16: =O16+P16 -> 0.000
A17: J Powell | B17: 1 | C17: 0 | D17: 0 | E17: 0 | F17: 0 | G17: 0 | H17: 0 | I17: 0 | J17: 0 | K17: 0 | L17: 0 | M17: 0 | N17: 0 | O17: 0.000 | P17: 0.000 | Q17: =O17+P17 -> 0.000
A18: E Ramirez | B18: 1 | C18: 0 | D18: 0 | E18: 0 | F18: 0 | G18: 0 | H18: 0 | I18: 0 | J18: 0 | K18: 0 | L18: 0 | M18: 0 | N18: 0 | O18: 0.000 | P18: 0.000 | Q18: =O18+P18 -> 0.000

A1: Player | B1: W | C1: L | D1: ERA | E1: G | F1: SV | G1: IP | H1: H | I1: R | J1: ER | K1: HR | L1: BB | M1: SO | N1: TB | O1: OBA | P1: SLG | Q1: OPS
A2: I Valdes | B2: 1 | C2: 0 | D2: 3.00 | E2: 2 | F2: 0 | G2: 12 | H2: 12 | I2: 4 | J2: 4 | K2: 1 | L2: 2 | M2: 4 | N2: 20 | O2: 0.29199999999999998 | P2: 0.44400000000000001 | Q2: =O2+P2 -> 0.73599999999999999
A3: J Thomson | B3: 1 | C3: 0 | D3: 4.50 | E3: 1 | F3: 0 | G3: 6 | H3: 6 | I3: 3 | J3: 3 | K3: 1 | L3: 2 | M3: 4 | N3: 11 | O3: 0.320 | P3: 0.47799999999999998 | Q3: =O3+P3 -> 0.79800000000000004
A4: R Garcia | B4: 0 | C4: 0 | D4: 0.00 | E4: 2 | F4: 0 | G4: 4.2 | H4: 2 | I4: 0 | J4: 0 | K4: 0 | L4: 0 | M4: 2 | N4: 2 | O4: 0.125 | P4: 0.125 | Q4: =O4+P4 -> 0.250
A5: E Ramirez | B5: 0 | C5: 0 | D5: 5.79 | E5: 3 | F5: 0 | G5: 4.2 | H5: 6 | I5: 3 | J5: 3 | K5: 1 | L5: 1 | M5: 2 | N5: 9 | O5: 0.400 | P5: 0.500 | Q5: =O5+P5 -> 0.900
A6: V Santos | B6: 0 | C6: 1 | D6: 9.64 | E6: 1 | F6: 0 | G6: 4.2 | H6: 7 | I6: 5 | J6: 5 | K6: 1 | L6: 1 | M6: 3 | N6: 12 | O6: 0.42099999999999999 | P6: 0.66700000000000004 | Q6: =O6+P6 -> 1.0880000000000001
A7: T Mounce | B7: 0 | C7: 1 | D7: 10.38 | E7: 1 | F7: 0 | G7: 4.1 | H7: 9 | I7: 5 | J7: 5 | K7: 1 | L7: 3 | M7: 2 | N7: 17 | O7: 0.54500000000000004 | P7: 0.89500000000000002 | Q7: =O7+P7 -> 1.440
A8: B Shouse | B8: 0 | C8: 0 | D8: 0.00 | E8: 1 | F8: 0 | G8: 3 | H8: 2 | I8: 0 | J8: 0 | K8: 0 | L8: 0 | M8: 1 | N8: 2 | O8: 0.200 | P8: 0.200 | Q8: =O8+P8 -> 0.400
A9: R Dickey | B9: 0 | C9: 0 | D9: 6.75 | E9: 1 | F9: 0 | G9: 2.2 | H9: 4 | I9: 2 | J9: 2 | K9: 0 | L9: 1 | M9: 0 | N9: 5 | O9: 0.38500000000000001 | P9: 0.41699999999999998 | Q9: =O9+P9 -> 0.80200000000000005
A10: A Fultz | B10: 0 | C10: 0 | D10: 3.38 | E10: 2 | F10: 0 | G10: 2.2 | H10: 2 | I10: 1 | J10: 1 | K10: 0 | L10: 0 | M10: 2 | N10: 3 | O10: 0.200 | P10: 0.300 | Q10: =O10+P10 -> 0.500
A11: C Lewis | B11: 0 | C11: 1 | D11: 23.14 | E11: 1 | F11: 0 | G11: 2.1 | H11: 7 | I11: 6 | J11: 6 | K11: 1 | L11: 1 | M11: 2 | N11: 12 | O11: 0.53300000000000003 | P11: 0.85699999999999998 | Q11: =O11+P11 -> 1.390
A12: J Powell | B12: 0 | C12: 0 | D12: 23.14 | E12: 4 | F12: 0 | G12: 2.1 | H12: 6 | I12: 6 | J12: 6 | K12: 1 | L12: 1 | M12: 0 | N12: 11 | O12: 0.53300000000000003 | P12: 0.84599999999999997 | Q12: =O12+P12 -> 1.379
A13: U Urbina | B13: 0 | C13: 0 | D13: 0.00 | E13: 2 | F13: 1 | G13: 2.1 | H13: 2 | I13: 0 | J13: 0 | K13: 0 | L13: 0 | M13: 1 | N13: 4 | O13: 0.222 | P13: 0.44400000000000001 | Q13: =O13+P13 -> 0.66600000000000004
A14: F Cordero | B14: 0 | C14: 1 | D14: 27.00 | E14: 2 | F14: 0 | G14: 1.1 | H14: 5 | I14: 4 | J14: 4 | K14: 0 | L14: 3 | M14: 0 | N14: 6 | O14: 0.66700000000000004 | P14: 0.66700000000000004 | Q14: =O14+P14 -> 1.3340000000000001

A1: Date | B1: IP | C1: H | D1: R | E1: BB
A2: 01 APR | B2: 0.2 | C2: 0 | D2: 0 | E2: 1
A3: 02 | B3: 1.0 | C3: 1 | D3: 2 | E3: 2
A4: 06 | B4: 1.1 | C4: 4 | D4: 5 | E4: 1
A5: 09 | B5: 1.1 | C5: 2 | D5: 2 | E5: 1
A6: 12 | B6: 2.0 | C6: 5 | D6: 3 | E6: 2
A7: 03 MAY | B7: 2.0 | C7: 2 | D7: 0 | E7: 0
A8: 06 | B8: 2.0 | C8: 6 | D8: 5 | E8: 1
A9: 08 | B9: 1.0 | C9: 0 | D9: 0 | E9: 1
A10: 10 | B10: 0.1 | C10: 1 | D10: 0 | E10: 0
A11: 11 | B11: 1.0 | C11: 2 | D11: 1 | E11: 0
A12: 15 | B12: 1.2 | C12: 3 | D12: 2 | E12: 0
A13: 24 | B13: 1.2 | C13: 3 | D13: 0 | E13: 0
A14: 30 | B14: 1.2 | C14: 2 | D14: 2 | E14: 2
A15: 04 JUN | B15: 0.1 | C15: 0 | D15: 0 | E15: 1
A16: 06 | B16: 2.0 | C16: 2 | D16: 2 | E16: 1
A17: 10 | B17: 0.0 | C17: 3 | D17: 3 | E17: 0
A18: 12 | B18: 1.0 | C18: 3 | D18: 3 | E18: 1
A19: 13 | B19: 0.1 | C19: 0 | D19: 0 | E19: 0
A20: 14 | B20: 1.0 | C20: 0 | D20: 0 | E20: 0