B1: Texas Rangers

A1: Player | B1: POS | C1: G | D1: AB | E1: R | F1: H | G1: 2B | H1: 3B | I1: HR | J1: RBI | K1: TB | L1: BB | M1: SO | N1: SB | O1: CS | P1: OBP | Q1: SLG | R1: AVG
A2: C Everett | B2: OF | C2: 6 | D2: 25 | E2: 3 | F2: 5 | G2: 2 | H2: 0 | I2: 1 | J2: 1 | K2: 10 | L2: 2 | M2: 4 | N2: 0 | O2: 0 | P2: 0.25900000000000001 | Q2: 0.400 | R2: 0.200
A3: J Gonzalez | B3: OF | C3: 6 | D3: 24 | E3: 7 | F3: 7 | G3: 1 | H3: 0 | I3: 2 | J3: 3 | K3: 14 | L3: 1 | M3: 6 | N3: 0 | O3: 0 | P3: 0.34599999999999997 | Q3: 0.58299999999999996 | R3: 0.29199999999999998
A4: R Palmeiro | B4: 1B | C4: 6 | D4: 24 | E4: 4 | F4: 5 | G4: 2 | H4: 0 | I4: 2 | J4: 6 | K4: 13 | L4: 2 | M4: 3 | N4: 0 | O4: 0 | P4: 0.26900000000000002 | Q4: 0.54200000000000004 | R4: 0.20799999999999999
A5: M Teixeira | B5: 1B | C5: 6 | D5: 23 | E5: 2 | F5: 5 | G5: 1 | H5: 0 | I5: 2 | J5: 8 | K5: 12 | L5: 0 | M5: 7 | N5: 0 | O5: 0 | P5: 0.250 | Q5: 0.52200000000000002 | R5: 0.217
A6: A Rodriguez | B6: SS | C6: 6 | D6: 22 | E6: 4 | F6: 5 | G6: 2 | H6: 0 | I6: 1 | J6: 2 | K6: 10 | L6: 4 | M6: 1 | N6: 0 | O6: 0 | P6: 0.34599999999999997 | Q6: 0.45500000000000002 | R6: 0.22700000000000001
A7: M Young | B7: 2B | C7: 6 | D7: 22 | E7: 0 | F7: 5 | G7: 1 | H7: 0 | I7: 0 | J7: 2 | K7: 6 | L7: 0 | M7: 4 | N7: 0 | O7: 0 | P7: 0.217 | Q7: 0.27300000000000002 | R7: 0.22700000000000001
A8: H Blalock | B8: 3B | C8: 6 | D8: 20 | E8: 4 | F8: 7 | G8: 3 | H8: 0 | I8: 0 | J8: 0 | K8: 10 | L8: 6 | M8: 0 | N8: 0 | O8: 0 | P8: 0.500 | Q8: 0.500 | R8: 0.350
A9: E Diaz | B9: C | C9: 5 | D9: 17 | E9: 1 | F9: 4 | G9: 0 | H9: 0 | I9: 1 | J9: 2 | K9: 7 | L9: 1 | M9: 2 | N9: 1 | O9: 0 | P9: 0.316 | Q9: 0.41199999999999998 | R9: 0.23499999999999999
A10: R Sierra | B10: OF | C10: 4 | D10: 15 | E10: 3 | F10: 3 | G10: 1 | H10: 0 | I10: 1 | J10: 4 | K10: 7 | L10: 3 | M10: 4 | N10: 0 | O10: 0 | P10: 0.33300000000000002 | Q10: 0.46700000000000003 | R10: 0.200
A11: R Christenson | B11: OF | C11: 4 | D11: 7 | E11: 0 | F11: 0 | G11: 0 | H11: 0 | I11: 0 | J11: 0 | K11: 0 | L11: 0 | M11: 1 | N11: 0 | O11: 1 | P11: 0.000 | Q11: 0.000 | R11: 0.000
A12: T Greene | B12: C | C12: 2 | D12: 4 | E12: 0 | F12: 0 | G12: 0 | H12: 0 | I12: 0 | J12: 0 | K12: 0 | L12: 0 | M12: 2 | N12: 0 | O12: 0 | P12: 0.000 | Q12: 0.000 | R12: 0.000
A13: M Lamb | B13: DH | C13: 1 | D13: 1 | E13: 0 | F13: 1 | G13: 0 | H13: 0 | I13: 0 | J13: 0 | K13: 1 | L13: 0 | M13: 0 | N13: 0 | O13: 0 | P13: 1.000 | Q13: 1.000 | R13: 1.000
A14: H Perry | B14: 1B | C14: 1 | D14: 1 | E14: 0 | F14: 0 | G14: 0 | H14: 0 | I14: 0 | J14: 0 | K14: 0 | L14: 0 | M14: 0 | N14: 0 | O14: 0 | P14: 0.000 | Q14: 0.000 | R14: 0.000

A1: Player | B1: W | C1: L | D1: ERA | E1: G | F1: GS | G1: SV | H1: SVO | I1: IP | J1: H | K1: R | L1: ER | M1: HR | N1: BB | O1: SO | P1: TB | Q1: SLG | R1: OBA | S1: OPS
A2: J Benoit | B2: 0 | C2: 1 | D2: 8.31 | E2: 2 | F2: 2 | G2: 0 | H2: 0 | I2: 8.2 | J2: 11 | K2: 10 | L2: 8 | M2: 2 | N2: 7 | O2: 5 | P2: 21 | Q2: 0.61799999999999999 | R2: 0.42899999999999999 | S2: =Q2+R2 -> 1.0469999999999999
A3: J Thomson | B3: 0 | C3: 1 | D3: 8.53 | E3: 1 | F3: 1 | G3: 0 | H3: 0 | I3: 6.1 | J3: 8 | K3: 6 | L3: 6 | M3: 1 | N3: 1 | O3: 4 | P3: 15 | Q3: 0.600 | R3: 0.34599999999999997 | S3: =Q3+R3 -> 0.94599999999999995
A4: I Valdes | B4: 1 | C4: 0 | D4: 3.18 | E4: 1 | F4: 1 | G4: 0 | H4: 0 | I4: 5.2 | J4: 4 | K4: 2 | L4: 2 | M4: 0 | N4: 1 | O4: 0 | P4: 6 | Q4: 0.28599999999999998 | R4: 0.22700000000000001 | S4: =Q4+R4 -> 0.51300000000000001
A5: R Dickey | B5: 0 | C5: 1 | D5: 9.00 | E5: 3 | F5: 0 | G5: 0 | H5: 0 | I5: 5 | J5: 8 | K5: 6 | L5: 5 | M5: 0 | N5: 2 | O5: 4 | P5: 10 | Q5: 0.435 | R5: 0.38500000000000001 | S5: =Q5+R5 -> 0.820
A6: C Lewis | B6: 1 | C6: 0 | D6: 1.80 | E6: 1 | F6: 1 | G6: 0 | H6: 0 | I6: 5 | J6: 4 | K6: 1 | L6: 1 | M6: 0 | N6: 2 | O6: 5 | P6: 5 | Q6: 0.27800000000000002 | R6: 0.300 | S6: =Q6+R6 -> 0.57800000000000007
A7: A Fultz | B7: 0 | C7: 0 | D7: 2.25 | E7: 2 | F7: 0 | G7: 0 | H7: 0 | I7: 4 | J7: 7 | K7: 1 | L7: 1 | M7: 0 | N7: 0 | O7: 2 | P7: 8 | Q7: 0.47099999999999997 | R7: 0.44400000000000001 | S7: =Q7+R7 -> 0.91500000000000004
A8: F Cordero | B8: 0 | C8: 0 | D8: 0.00 | E8: 2 | F8: 0 | G8: 1 | H8: 1 | I8: 3.2 | J8: 1 | K8: 0 | L8: 0 | M8: 0 | N8: 1 | O8: 3 | P8: 1 | Q8: 9.0999999999999998E-2 | R8: 0.16700000000000001 | S8: =Q8+R8 -> 0.25800000000000001
A9: B Shouse | B9: 0 | C9: 0 | D9: 2.45 | E9: 4 | F9: 0 | G9: 0 | H9: 0 | I9: 3.2 | J9: 3 | K9: 1 | L9: 1 | M9: 0 | N9: 1 | O9: 0 | P9: 4 | Q9: 0.308 | R9: 0.28599999999999998 | S9: =Q9+R9 -> 0.59399999999999997
A10: A Benes | B10: 0 | C10: 1 | D10: 10.80 | E10: 1 | F10: 1 | G10: 0 | H10: 0 | I10: 3.1 | J10: 6 | K10: 4 | L10: 4 | M10: 2 | N10: 4 | O10: 5 | P10: 12 | Q10: 0.800 | R10: 0.52600000000000002 | S10: =Q10+R10 -> 1.3260000000000001
A11: J Powell | B11: 0 | C11: 0 | D11: 10.80 | E11: 1 | F11: 0 | G11: 0 | H11: 0 | I11: 1.2 | J11: 2 | K11: 2 | L11: 2 | M11: 0 | N11: 2 | O11: 3 | P11: 3 | Q11: 0.42899999999999999 | R11: 0.44400000000000001 | S11: =Q11+R11 -> 0.873
A12: R Garcia | B12: 0 | C12: 0 | D12: 18.00 | E12: 1 | F12: 0 | G12: 0 | H12: 0 | I12: 1 | J12: 3 | K12: 2 | L12: 2 | M12: 0 | N12: 2 | O12: 0 | P12: 3 | Q12: 0.600 | R12: 0.71399999999999997 | S12: =Q12+R12 -> 1.3140000000000001
A13: R Garcia | B13: 0 | C13: 0 | D13: 18.00 | E13: 2 | F13: 0 | G13: 0 | H13: 0 | I13: 1 | J13: 4 | K13: 2 | L13: 2 | M13: 0 | N13: 0 | O13: 0 | P13: 6 | Q13: 0.85699999999999998 | R13: 0.57099999999999995 | S13: =Q13+R13 -> 1.4279999999999999
A14: U Urbina | B14: 0 | C14: 0 | D14: 9.00 | E14: 1 | F14: 0 | G14: 1 | H14: 1 | I14: 1 | J14: 2 | K14: 1 | L14: 1 | M14: 1 | N14: 0 | O14: 0 | P14: 5 | Q14: 1.000 | R14: 0.400 | S14: =Q14+R14 -> 1.400
A15: T Van Poppel | B15: 0 | C15: 0 | D15: 18.00 | E15: 1 | F15: 0 | G15: 0 | H15: 0 | I15: 1 | J15: 3 | K15: 2 | L15: 2 | M15: 0 | N15: 0 | O15: 1 | P15: 6 | Q15: 1.000 | R15: 0.500 | S15: =Q15+R15 -> 1.500

A1: DATE
A2: 37742 | B2: @TOR | C2: 5 | D2: 1 | E2: 1 | F2: 0 | G2: 0 | H2: 1 | I2: 2 | J2: 4 | K2: 0 | L2: 0 | M2: 0 | N2: 0 | O2: 0 | P2: 0.400 | Q2: 0.753 | R2: 0.32600000000000001
A3: 37743 | B3: @CLE | C3: 5 | D3: 1 | E3: 1 | F3: 1 | G3: 0 | H3: 0 | I3: 1 | J3: 2 | K3: 0 | L3: 3 | M3: 0 | N3: 0 | O3: 0 | P3: 0.390 | Q3: 0.73399999999999999 | R3: 0.31900000000000001
A4: 37744 | B4: @CLE | C4: 4 | D4: 1 | E4: 2 | F4: 1 | G4: 1 | H4: 0 | I4: 1 | J4: 5 | K4: 0 | L4: 0 | M4: 0 | N4: 0 | O4: 0 | P4: 0.39400000000000002 | Q4: 0.755 | R4: 0.32700000000000001
A5: 37745 | B5: @CLE | C5: 3 | D5: 0 | E5: 1 | F5: 0 | G5: 0 | H5: 0 | I5: 1 | J5: 1 | K5: 1 | L5: 2 | M5: 0 | N5: 0 | O5: 0 | P5: 0.39800000000000002 | Q5: 0.74299999999999999 | R5: 0.32700000000000001
A6: 37747 | B6: TOR | C6: 4 | D6: 1 | E6: 1 | F6: 0 | G6: 0 | H6: 1 | I6: 4 | J6: 4 | K6: 0 | L6: 0 | M6: 0 | N6: 0 | O6: 0 | P6: 0.39300000000000002 | Q6: 0.752 | R6: 0.32400000000000001
A7: 37748 | B7: TOR | C7: 2 | D7: 1 | E7: 0 | F7: 0 | G7: 0 | H7: 0 | I7: 0 | J7: 0 | K7: 2 | L7: 0 | M7: 1 | N7: 0 | O7: 0 | P7: 0.39700000000000002 | Q7: 0.73799999999999999 | R7: 0.318
A8: 37749 | B8: TOR | C8: 4 | D8: 1 | E8: 3 | F8: 1 | G8: 0 | H8: 0 | I8: 2 | J8: 4 | K8: 0 | L8: 1 | M8: 0 | N8: 0 | O8: 0 | P8: 0.40500000000000003 | Q8: 0.748 | R8: 0.33300000000000002
A9: 37750 | B9: CLE | C9: 2 | D9: 1 | E9: 0 | F9: 0 | G9: 0 | H9: 0 | I9: 0 | J9: 0 | K9: 1 | L9: 0 | M9: 0 | N9: 0 | O9: 1 | P9: 0.40799999999999997 | Q9: 0.73499999999999999 | R9: 0.32700000000000001
A10: 37751 | B10: CLE | C10: 3 | D10: 2 | E10: 1 | F10: 0 | G10: 0 | H10: 0 | I10: 0 | J10: 1 | K10: 2 | L10: 0 | M10: 0 | N10: 0 | O10: 0 | P10: 0.41499999999999998 | Q10: 0.72399999999999998 | R10: 0.32800000000000001
A11: 37752 | B11: CLE | C11: 5 | D11: 3 | E11: 2 | F11: 0 | G11: 0 | H11: 1 | I11: 3 | J11: 5 | K11: 1 | L11: 1 | M11: 0 | N11: 0 | O11: 0 | P11: 0.41799999999999998 | Q11: 0.73599999999999999 | R11: 0.33100000000000002
A12: 37754 | B12: @BOS | C12: 4 | D12: 0 | E12: 1 | F12: 0 | G12: 0 | H12: 0 | I12: 0 | J12: 1 | K12: 0 | L12: 0 | M12: 0 | N12: 0 | O12: 0 | P12: 0.41399999999999998 | Q12: 0.720 | R12: 0.32800000000000001
A13: 37755 | B13: @BOS | C13: 4 | D13: 0 | E13: 1 | F13: 0 | G13: 0 | H13: 0 | I13: 1 | J13: 1 | K13: 0 | L13: 0 | M13: 0 | N13: 0 | O13: 0 | P13: 0.40899999999999997 | Q13: 0.70499999999999996 | R13: 0.32600000000000001
A14: 37756 | B14: @BOS | C14: 3 | D14: 1 | E14: 1 | F14: 0 | G14: 0 | H14: 1 | I14: 1 | J14: 4 | K14: 0 | L14: 1 | M14: 0 | N14: 0 | O14: 0 | P14: 0.40799999999999997 | Q14: 0.720 | R14: 0.32600000000000001
A15: 37757 | B15: @NYA | C15: 3 | D15: 2 | E15: 1 | F15: 0 | G15: 0 | H15: 0 | I15: 1 | J15: 1 | K15: 3 | L15: 1 | M15: 0 | N15: 0 | O15: 1 | P15: 0.42099999999999999 | Q15: 0.71099999999999997 | R15: 0.32600000000000001
A16: 37758 | B16: @NYA | C16: 4 | D16: 1 | E16: 2 | F16: 0 | G16: 0 | H16: 0 | I16: 2 | J16: 2 | K16: 1 | L16: 1 | M16: 0 | N16: 0 | O16: 0 | P16: 0.42699999999999999 | Q16: 0.70499999999999996 | R16: 0.33100000000000002
A17: 37759 | B17: @NYA | C17: 5 | D17: 0 | E17: 2 | F17: 0 | G17: 0 | H17: 0 | I17: 1 | J17: 2 | K17: 0 | L17: 1 | M17: 0 | N17: 0 | O17: 0 | P17: 0.42599999999999999 | Q17: 0.69399999999999995 | R17: 0.33300000000000002
A18: 37761 | B18: TBA | C18: 3 | D18: 0 | E18: 0 | F18: 0 | G18: 0 | H18: 0 | I18: 1 | J18: 0 | K18: 0 | L18: 0 | M18: 0 | N18: 0 | O18: 0 | P18: 0.41599999999999998 | Q18: 0.680 | R18: 0.32700000000000001
A19: 37763 | B19: TBA | C19: 3 | D19: 1 | E19: 1 | F19: 0 | G19: 0 | H19: 0 | I19: 0 | J19: 1 | K19: 2 | L19: 0 | M19: 0 | N19: 0 | O19: 0 | P19: 0.42099999999999999 | Q19: 0.67300000000000004 | R19: 0.32700000000000001
A20: 37764 | B20: BAL | C20: 5 | D20: 1 | E20: 1 | F20: 0 | G20: 0 | H20: 0 | I20: 0 | J20: 1 | K20: 0 | L20: 1 | M20: 0 | N20: 0 | O20: 0 | P20: 0.41499999999999998 | Q20: 0.65800000000000003 | R20: 0.32300000000000001
A21: 37766 | B21: BAL | C21: 4 | D21: 1 | E21: 2 | F21: 1 | G21: 0 | H21: 1 | I21: 1 | J21: 6 | K21: 1 | L21: 1 | M21: 0 | N21: 0 | O21: 0 | P21: 0.420 | Q21: 0.67900000000000005 | R21: 0.32700000000000001
A22: 37768 | B22: @TBA | C22: 4 | D22: 0 | E22: 0 | F22: 0 | G22: 0 | H22: 0 | I22: 0 | J22: 0 | K22: 0 | L22: 0 | M22: 0 | N22: 0 | O22: 0 | P22: 0.41099999999999998 | Q22: 0.66300000000000003 | R22: 0.31900000000000001
A23: 37769 | B23: @TBA | C23: 4 | D23: 0 | E23: 0 | F23: 0 | G23: 0 | H23: 0 | I23: 0 | J23: 0 | K23: 1 | L23: 1 | M23: 0 | N23: 0 | O23: 0 | P23: 0.40600000000000003 | Q23: 0.64700000000000002 | R23: 0.311
A24: 37770 | B24: @BAL | C24: 5 | D24: 2 | E24: 2 | F24: 0 | G24: 0 | H24: 0 | I24: 0 | J24: 2 | K24: 0 | L24: 0 | M24: 0 | N24: 0 | O24: 0 | P24: 0.40600000000000003 | Q24: 0.640 | R24: 0.314
A25: 37771 | B25: @BAL | C25: 4 | D25: 0 | E25: 0 | F25: 0 | G25: 0 | H25: 0 | I25: 0 | J25: 0 | K25: 0 | L25: 2 | M25: 0 | N25: 0 | O25: 0 | P25: 0.39800000000000002 | Q25: 0.625 | R25: 0.307
A26: 37772 | B26: @BAL | C26: 4 | D26: 0 | E26: 1 | F26: 1 | G26: 0 | H26: 0 | I26: 0 | J26: 2 | K26: 0 | L26: 0 | M26: 0 | N26: 0 | O26: 0 | P26: 0.39500000000000002 | Q26: 0.622 | R26: 0.30599999999999999
A27: Thru 17 | C27: =SUM(C2:C16) -> 55 | D27: =SUM(D2:D16) -> 16 | E27: =SUM(E2:E16) -> 18 | F27: =SUM(F2:F16) -> 3 | G27: =SUM(G2:G16) -> 1 | H27: =SUM(H2:H16) -> 4 | I27: =SUM(I2:I16) -> 19 | J27: =SUM(J2:J16) -> 35 | K27: =SUM(K2:K16) -> 11 | L27: =SUM(L2:L16) -> 10 | M27: =SUM(M2:M16) -> 1 | N27: =SUM(N2:N16) -> 0 | O27: =SUM(O2:O16) -> 2 | P27: =(E27+K27)/(C27+K27) -> 0.43939393939393939 | Q27: =J27/C27 -> 0.63636363636363635 | R27: =E27/C27 -> 0.32727272727272727
A28: 17-31 | C28: =SUM(C17:C26) -> 41 | D28: =SUM(D17:D26) -> 5 | E28: =SUM(E17:E26) -> 9 | F28: =SUM(F17:F26) -> 2 | G28: =SUM(G17:G26) -> 0 | H28: =SUM(H17:H26) -> 1 | I28: =SUM(I17:I26) -> 3 | J28: =SUM(J17:J26) -> 14 | K28: =SUM(K17:K26) -> 4 | L28: =SUM(L17:L26) -> 6 | M28: =SUM(M17:M26) -> 0 | N28: =SUM(N17:N26) -> 0 | O28: =SUM(O17:O26) -> 0 | P28: =(E28+K28)/(C28+K28) -> 0.28888888888888886 | Q28: =J28/C28 -> 0.34146341463414637 | R28: =E28/C28 -> 0.21951219512195122

A1: GAME

A1: AB

A1: R

A1: H

A1: 2B

A1: 3B

A1: HR

A1: RBI

A1: TB

A1: BB

A1: SO

A1: SB

A1: CS

A1: HBP

A1: OBP

A1: SLG

A1: AVG