B1: Texas Rangers

A1: Player | B1: G | C1: AB | D1: R | E1: H | F1: 2B | G1: 3B | H1: HR | I1: RBI | J1: TB | K1: BB | L1: SO | M1: SB | N1: CS | O1: OBP | P1: SLG | Q1: OPS
A2: M Young | B2: 7 | C2: 30 | D2: 6 | E2: 10 | F2: 0 | G2: 0 | H2: 2 | I2: 4 | J2: 16 | K2: 1 | L2: 3 | M2: 1 | N2: 0 | O2: 0.34399999999999997 | P2: 0.53300000000000003 | Q2: =O2+P2 -> 0.877
A3: R Palmeiro | B3: 7 | C3: 28 | D3: 3 | E3: 2 | F3: 0 | G3: 0 | H3: 1 | I3: 2 | J3: 5 | K3: 3 | L3: 3 | M3: 0 | N3: 0 | O3: 0.156 | P3: 0.17899999999999999 | Q3: =O3+P3 -> 0.33500000000000002
A4: K Mench | B4: 7 | C4: 27 | D4: 3 | E4: 10 | F4: 1 | G4: 0 | H4: 1 | I4: 6 | J4: 14 | K4: 0 | L4: 3 | M4: 0 | N4: 1 | O4: 0.35699999999999998 | P4: 0.51900000000000002 | Q4: =O4+P4 -> 0.876
A5: H Blalock | B5: 6 | C5: 26 | D5: 7 | E5: 8 | F5: 1 | G5: 0 | H5: 2 | I5: 2 | J5: 15 | K5: 2 | L5: 6 | M5: 0 | N5: 0 | O5: 0.35699999999999998 | P5: 0.57699999999999996 | Q5: =O5+P5 -> 0.93399999999999994
A6: A Rodriguez | B6: 7 | C6: 26 | D6: 5 | E6: 8 | F6: 2 | G6: 2 | H6: 2 | I6: 8 | J6: 20 | K6: 3 | L6: 4 | M6: 0 | N6: 0 | O6: 0.40600000000000003 | P6: 0.76900000000000002 | Q6: =O6+P6 -> 1.175
A7: J Gonzalez | B7: 5 | C7: 22 | D7: 4 | E7: 6 | F7: 1 | G7: 0 | H7: 2 | I7: 9 | J7: 13 | K7: 1 | L7: 2 | M7: 0 | N7: 0 | O7: 0.30399999999999999 | P7: 0.59099999999999997 | Q7: =O7+P7 -> 0.89500000000000002
A8: M Teixeira | B8: 6 | C8: 18 | D8: 2 | E8: 4 | F8: 0 | G8: 0 | H8: 1 | I8: 1 | J8: 7 | K8: 3 | L8: 5 | M8: 0 | N8: 0 | O8: 0.36399999999999999 | P8: 0.38900000000000001 | Q8: =O8+P8 -> 0.753
A9: E Diaz | B9: 4 | C9: 16 | D9: 0 | E9: 5 | F9: 1 | G9: 0 | H9: 0 | I9: 1 | J9: 6 | K9: 0 | L9: 3 | M9: 0 | N9: 0 | O9: 0.313 | P9: 0.375 | Q9: =O9+P9 -> 0.68799999999999994
A10: T Greene | B10: 3 | C10: 12 | D10: 1 | E10: 2 | F10: 2 | G10: 0 | H10: 0 | I10: 1 | J10: 4 | K10: 0 | L10: 5 | M10: 0 | N10: 0 | O10: 0.16700000000000001 | P10: 0.33300000000000002 | Q10: =O10+P10 -> 0.500
A11: D Sadler | B11: 6 | C11: 12 | D11: 2 | E11: 2 | F11: 0 | G11: 0 | H11: 0 | I11: 0 | J11: 2 | K11: 1 | L11: 4 | M11: 0 | N11: 1 | O11: 0.23100000000000001 | P11: 0.16700000000000001 | Q11: =O11+P11 -> 0.39800000000000002
A12: D Glanville | B12: 5 | C12: 10 | D12: 0 | E12: 2 | F12: 0 | G12: 0 | H12: 0 | I12: 0 | J12: 2 | K12: 0 | L12: 2 | M12: 0 | N12: 0 | O12: 0.200 | P12: 0.200 | Q12: =O12+P12 -> 0.400
A13: R Ludwick | B13: 2 | C13: 7 | D13: 0 | E13: 1 | F13: 0 | G13: 0 | H13: 0 | I13: 0 | J13: 1 | K13: 0 | L13: 3 | M13: 0 | N13: 0 | O13: 0.14299999999999999 | P13: 0.14299999999999999 | Q13: =O13+P13 -> 0.28599999999999998
A14: C Everett | B14: 2 | C14: 5 | D14: 0 | E14: 1 | F14: 0 | G14: 0 | H14: 0 | I14: 0 | J14: 1 | K14: 2 | L14: 0 | M14: 0 | N14: 0 | O14: 0.42899999999999999 | P14: 0.200 | Q14: =O14+P14 -> 0.629
A15: M Lamb | B15: 1 | C15: 3 | D15: 1 | E15: 1 | F15: 0 | G15: 0 | H15: 0 | I15: 0 | J15: 1 | K15: 1 | L15: 1 | M15: 0 | N15: 0 | O15: 0.500 | P15: 0.33300000000000002 | Q15: =O15+P15 -> 0.83299999999999996
A16: M Ramos | B16: 1 | C16: 1 | D16: 0 | E16: 0 | F16: 0 | G16: 0 | H16: 0 | I16: 0 | J16: 0 | K16: 0 | L16: 1 | M16: 0 | N16: 0 | O16: 0.000 | P16: 0.000 | Q16: =O16+P16 -> 0.000
A17: V Santos | B17: 1 | C17: 1 | D17: 0 | E17: 0 | F17: 0 | G17: 0 | H17: 0 | I17: 0 | J17: 0 | K17: 0 | L17: 1 | M17: 0 | N17: 0 | O17: 0.000 | P17: 0.000 | Q17: =O17+P17 -> 0.000
A18: F Cordero | B18: 1 | C18: 0 | D18: 0 | E18: 0 | F18: 0 | G18: 0 | H18: 0 | I18: 0 | J18: 0 | K18: 0 | L18: 0 | M18: 0 | N18: 0 | O18: 0.000 | P18: 0.000 | Q18: =O18+P18 -> 0.000
A19: R Garcia | B19: 1 | C19: 0 | D19: 0 | E19: 0 | F19: 0 | G19: 0 | H19: 0 | I19: 0 | J19: 0 | K19: 0 | L19: 0 | M19: 0 | N19: 0 | O19: 0.000 | P19: 0.000 | Q19: =O19+P19 -> 0.000
A20: U Urbina | B20: 1 | C20: 0 | D20: 0 | E20: 0 | F20: 0 | G20: 0 | H20: 0 | I20: 0 | J20: 0 | K20: 0 | L20: 0 | M20: 0 | N20: 0 | O20: 0.000 | P20: 0.000 | Q20: =O20+P20 -> 0.000

A1: Player | B1: W | C1: L | D1: ERA | E1: G | F1: SV | G1: IP | H1: H | I1: R | J1: ER | K1: HR | L1: BB | M1: SO | N1: TB | O1: OBA | P1: SLG | Q1: OPS
A2: J Thomson | B2: 1 | C2: 0 | D2: 3.21 | E2: 2 | F2: 0 | G2: 14 | H2: 9 | I2: 5 | J2: 5 | K2: 2 | L2: 2 | M2: 9 | N2: 17 | O2: 0.216 | P2: 0.35399999999999998 | Q2: =O2+P2 -> 0.570
A3: V Santos | B3: 0 | C3: 0 | D3: 4.05 | E3: 2 | F3: 0 | G3: 6.2 | H3: 4 | I3: 3 | J3: 3 | K3: 0 | L3: 6 | M3: 2 | N3: 4 | O3: 0.33300000000000002 | P3: 0.17399999999999999 | Q3: =O3+P3 -> 0.50700000000000001
A4: F Cordero | B4: 0 | C4: 0 | D4: 3.00 | E4: 4 | F4: 0 | G4: 6 | H4: 6 | I4: 2 | J4: 2 | K4: 0 | L4: 0 | M4: 6 | N4: 9 | O4: 0.27300000000000002 | P4: 0.40899999999999997 | Q4: =O4+P4 -> 0.68199999999999994
A5: T Mounce | B5: 1 | C5: 0 | D5: 5.06 | E5: 1 | F5: 0 | G5: 5.1 | H5: 6 | I5: 3 | J5: 3 | K5: 0 | L5: 0 | M5: 2 | N5: 9 | O5: 0.27300000000000002 | P5: 0.40899999999999997 | Q5: =O5+P5 -> 0.68199999999999994
A6: I Valdes | B6: 0 | C6: 1 | D6: 10.80 | E6: 1 | F6: 0 | G6: 5 | H6: 7 | I6: 7 | J6: 6 | K6: 2 | L6: 2 | M6: 1 | N6: 15 | O6: 0.39100000000000001 | P6: 0.750 | Q6: =O6+P6 -> 1.141
A7: J Benoit | B7: 0 | C7: 1 | D7: 9.64 | E7: 1 | F7: 0 | G7: 4.2 | H7: 6 | I7: 5 | J7: 5 | K7: 1 | L7: 3 | M7: 2 | N7: 14 | O7: 0.42899999999999999 | P7: 0.82399999999999995 | Q7: =O7+P7 -> 1.2529999999999999
A8: R Dickey | B8: 1 | C8: 0 | D8: 0.00 | E8: 2 | F8: 0 | G8: 4 | H8: 3 | I8: 0 | J8: 0 | K8: 0 | L8: 0 | M8: 4 | N8: 3 | O8: 0.214 | P8: 0.214 | Q8: =O8+P8 -> 0.42799999999999999
A9: U Urbina | B9: 0 | C9: 1 | D9: 2.25 | E9: 5 | F9: 4 | G9: 4 | H9: 4 | I9: 1 | J9: 1 | K9: 0 | L9: 0 | M9: 7 | N9: 4 | O9: 0.26700000000000002 | P9: 0.26700000000000002 | Q9: =O9+P9 -> 0.53400000000000003
A10: M Ramos | B10: 0 | C10: 0 | D10: 8.10 | E10: 1 | F10: 0 | G10: 3.1 | H10: 2 | I10: 3 | J10: 3 | K10: 0 | L10: 7 | M10: 1 | N10: 4 | O10: 0.52600000000000002 | P10: 0.36399999999999999 | Q10: =O10+P10 -> 0.890
A11: Ro Garcia | B11: 1 | C11: 0 | D11: 6.75 | E11: 3 | F11: 0 | G11: 2.2 | H11: 2 | I11: 2 | J11: 2 | K11: 1 | L11: 1 | M11: 3 | N11: 6 | O11: 0.250 | P11: 0.54500000000000004 | Q11: =O11+P11 -> 0.79500000000000004
A12: R Mahay | B12: 0 | C12: 0 | D12: 0.00 | E12: 2 | F12: 0 | G12: 2.2 | H12: 1 | I12: 0 | J12: 0 | K12: 0 | L12: 1 | M12: 4 | N12: 1 | O12: 0.200 | P12: 0.111 | Q12: =O12+P12 -> 0.311
A13: J Powell | B13: 0 | C13: 0 | D13: 0.00 | E13: 2 | F13: 0 | G13: 2 | H13: 0 | I13: 0 | J13: 0 | K13: 0 | L13: 1 | M13: 0 | N13: 0 | O13: 0.16700000000000001 | P13: 0.000 | Q13: =O13+P13 -> 0.16700000000000001
A14: B Shouse | B14: 0 | C14: 0 | D14: 0.00 | E14: 2 | F14: 0 | G14: 1.2 | H14: 1 | I14: 0 | J14: 0 | K14: 0 | L14: 0 | M14: 1 | N14: 2 | O14: 0.200 | P14: 0.400 | Q14: =O14+P14 -> 0.600

A1: TIME PERIOD | B1: AB | C1: H | D1: BB | E1: TB | F1: HR | G1: HBP | H1: BA | I1: OBA | J1: SLG | K1: OPS
A2: THRU 17 MAY | B2: 139 | C2: 46 | D2: 19 | E2: 98 | F2: 13 | G2: 5 | H2: .331 | I2: .411 | J2: .705 | K2: 1.116
A3: AFTER 17 MAY | B3: 104 | C3: 22 | D3: 8 | E3: 38 | F3: 4 | G3: 0 | H3: .212 | I3: .267 | J3: .365 | K3: .633