B1: Texas Rangers

A1: Player | B1: G | C1: AB | D1: R | E1: H | F1: 2B | G1: 3B | H1: HR | I1: RBI | J1: TB | K1: BB | L1: SO | M1: SB | N1: CS | O1: OBP | P1: SLG | Q1: OPS
A2: M Young | B2: 7 | C2: 28 | D2: 11 | E2: 11 | F2: 1 | G2: 2 | H2: 1 | I2: 4 | J2: 19 | K2: 4 | L2: 1 | M2: 1 | N2: 0 | O2: 0.45500000000000002 | P2: 0.67900000000000005 | Q2: =O2+P2 -> 1.1340000000000001
A3: M Teixeira | B3: 7 | C3: 27 | D3: 7 | E3: 5 | F3: 3 | G3: 0 | H3: 0 | I3: 4 | J3: 8 | K3: 1 | L3: 5 | M3: 0 | N3: 0 | O3: 0.24099999999999999 | P3: 0.29599999999999999 | Q3: =O3+P3 -> 0.53699999999999992
A4: H Blalock | B4: 6 | C4: 24 | D4: 3 | E4: 7 | F4: 2 | G4: 0 | H4: 1 | I4: 7 | J4: 12 | K4: 3 | L4: 3 | M4: 0 | N4: 1 | O4: 0.35699999999999998 | P4: 0.500 | Q4: =O4+P4 -> 0.85699999999999998
A5: R Palmeiro | B5: 6 | C5: 24 | D5: 5 | E5: 9 | F5: 3 | G5: 2 | H5: 1 | I5: 10 | J5: 19 | K5: 1 | L5: 1 | M5: 0 | N5: 0 | O5: 0.42299999999999999 | P5: 0.79200000000000004 | Q5: =O5+P5 -> 1.2150000000000001
A6: A Rodriguez | B6: 7 | C6: 24 | D6: 9 | E6: 10 | F6: 2 | G6: 0 | H6: 2 | I6: 6 | J6: 18 | K6: 7 | L6: 2 | M6: 3 | N6: 0 | O6: 0.56299999999999994 | P6: 0.750 | Q6: =O6+P6 -> 1.3129999999999999
A7: R Nivar | B7: 6 | C7: 22 | D7: 5 | E7: 7 | F7: 0 | G7: 1 | H7: 0 | I7: 1 | J7: 9 | K7: 1 | L7: 3 | M7: 2 | N7: 0 | O7: 0.375 | P7: 0.40899999999999997 | Q7: =O7+P7 -> 0.78400000000000003
A8: L Nix | B8: 5 | C8: 19 | D8: 2 | E8: 8 | F8: 1 | G8: 0 | H8: 0 | I8: 5 | J8: 9 | K8: 0 | L8: 7 | M8: 0 | N8: 0 | O8: 0.400 | P8: 0.47399999999999998 | Q8: =O8+P8 -> 0.874
A9: S Spencer | B9: 5 | C9: 17 | D9: 2 | E9: 4 | F9: 0 | G9: 0 | H9: 1 | I9: 3 | J9: 7 | K9: 3 | L9: 2 | M9: 0 | N9: 0 | O9: 0.33300000000000002 | P9: 0.41199999999999998 | Q9: =O9+P9 -> 0.745
A10: T Greene | B10: 4 | C10: 16 | D10: 4 | E10: 5 | F10: 1 | G10: 0 | H10: 3 | I10: 6 | J10: 15 | K10: 0 | L10: 2 | M10: 0 | N10: 0 | O10: 0.313 | P10: 0.93799999999999994 | Q10: =O10+P10 -> 1.2509999999999999
A11: E Diaz | B11: 3 | C11: 11 | D11: 0 | E11: 0 | F11: 0 | G11: 0 | H11: 0 | I11: 1 | J11: 0 | K11: 0 | L11: 0 | M11: 0 | N11: 0 | O11: 0.000 | P11: 0.000 | Q11: =O11+P11 -> 0.000
A12: J Jones | B12: 3 | C12: 9 | D12: 3 | E12: 3 | F12: 2 | G12: 0 | H12: 1 | I12: 4 | J12: 8 | K12: 2 | L12: 2 | M12: 0 | N12: 0 | O12: 0.45500000000000002 | P12: 0.88900000000000001 | Q12: =O12+P12 -> 1.3440000000000001
A13: D Sadler | B13: 4 | C13: 7 | D13: 2 | E13: 0 | F13: 0 | G13: 0 | H13: 0 | I13: 0 | J13: 0 | K13: 0 | L13: 3 | M13: 0 | N13: 0 | O13: 0.222 | P13: 0.000 | Q13: =O13+P13 -> 0.222
A14: M Thames | B14: 2 | C14: 5 | D14: 1 | E14: 1 | F14: 0 | G14: 0 | H14: 0 | I14: 1 | J14: 1 | K14: 1 | L14: 0 | M14: 0 | N14: 0 | O14: 0.375 | P14: 0.200 | Q14: =O14+P14 -> 0.57499999999999996

A1: Player | B1: W | C1: L | D1: ERA | E1: G | F1: SV | G1: IP | H1: H | I1: R | J1: ER | K1: HR | L1: BB | M1: SO | N1: TB | O1: OBA | P1: SLG | Q1: OPS
A2: C Lewis | B2: 2 | C2: 0 | D2: 4.26 | E2: 2 | F2: 0 | G2: 12.2 | H2: 14 | I2: 6 | J2: 6 | K2: 1 | L2: 3 | M2: 15 | N2: 24 | O2: 0.32700000000000001 | P2: 0.490 | Q2: =O2+P2 -> 0.81699999999999995
A3: J Benoit | B3: 2 | C3: 0 | D3: 5.79 | E3: 2 | F3: 0 | G3: 9.1 | H3: 11 | I3: 6 | J3: 6 | K3: 1 | L3: 4 | M3: 6 | N3: 20 | O3: 0.35699999999999998 | P3: 0.52600000000000002 | Q3: =O3+P3 -> 0.88300000000000001
A4: J Thomson | B4: 1 | C4: 0 | D4: 3.12 | E4: 2 | F4: 0 | G4: 8.2 | H4: 9 | I4: 3 | J4: 3 | K4: 0 | L4: 0 | M4: 6 | N4: 14 | O4: 0.28100000000000003 | P4: 0.438 | Q4: =O4+P4 -> 0.71900000000000008
A5: R Dickey | B5: 1 | C5: 0 | D5: 4.50 | E5: 1 | F5: 0 | G5: 6 | H5: 7 | I5: 3 | J5: 3 | K5: 1 | L5: 2 | M5: 3 | N5: 10 | O5: 0.34599999999999997 | P5: 0.41699999999999998 | Q5: =O5+P5 -> 0.7629999999999999
A6: E Ramirez | B6: 0 | C6: 0 | D6: 0.00 | E6: 2 | F6: 0 | G6: 5.2 | H6: 2 | I6: 0 | J6: 0 | K6: 0 | L6: 0 | M6: 3 | N6: 2 | O6: 0.111 | P6: 0.111 | Q6: =O6+P6 -> 0.222
A7: J Dominguez | B7: 0 | C7: 1 | D7: 7.71 | E7: 1 | F7: 0 | G7: 4.2 | H7: 7 | I7: 4 | J7: 4 | K7: 2 | L7: 0 | M7: 4 | N7: 14 | O7: 0.350 | P7: 0.73699999999999999 | Q7: =O7+P7 -> 1.087
A8: R Mahay | B8: 0 | C8: 0 | D8: 2.45 | E8: 3 | F8: 0 | G8: 3.2 | H8: 3 | I8: 1 | J8: 1 | K8: 1 | L8: 2 | M8: 3 | N8: 6 | O8: 0.313 | P8: 0.42899999999999999 | Q8: =O8+P8 -> 0.74199999999999999
A9: F Cordero | B9: 0 | C9: 0 | D9: 2.70 | E9: 3 | F9: 3 | G9: 3.1 | H9: 3 | I9: 1 | J9: 1 | K9: 0 | L9: 3 | M9: 2 | N9: 3 | O9: 0.375 | P9: 0.23100000000000001 | Q9: =O9+P9 -> 0.60599999999999998
A10: A Fultz | B10: 0 | C10: 0 | D10: 0.00 | E10: 2 | F10: 0 | G10: 3.1 | H10: 3 | I10: 0 | J10: 0 | K10: 0 | L10: 1 | M10: 1 | N10: 3 | O10: 0.308 | P10: 0.250 | Q10: =O10+P10 -> 0.55800000000000005
A11: B Shouse | B11: 0 | C11: 0 | D11: 3.38 | E11: 3 | F11: 0 | G11: 2.2 | H11: 3 | I11: 1 | J11: 1 | K11: 0 | L11: 0 | M11: 3 | N11: 3 | O11: 0.300 | P11: 0.300 | Q11: =O11+P11 -> 0.600
A12: R Ellis | B12: 0 | C12: 0 | D12: 22.50 | E12: 1 | F12: 0 | G12: 2 | H12: 6 | I12: 5 | J12: 5 | K12: 2 | L12: 1 | M12: 1 | N12: 14 | O12: 0.53800000000000003 | P12: 1.167 | Q12: =O12+P12 -> 1.7050000000000001
A13: J Powell | B13: 0 | C13: 0 | D13: 18.00 | E13: 2 | F13: 0 | G13: 1 | H13: 3 | I13: 3 | J13: 2 | K13: 0 | L13: 1 | M13: 1 | N13: 3 | O13: 0.66700000000000004 | P13: 0.600 | Q13: =O13+P13 -> 1.2669999999999999

A1: DATE | C1: GAME | E1: W | G1: L | I1: ERA | K1: G | M1: GS | O1: CG | Q1: SHO | S1: SV | U1: SVO | W1: IP | Y1: H | AA1: R | AC1: ER | AE1: HR | AG1: BB | AI1: SO
A2: JUL 22 | C2: @BAL | E2: 0 | G2: 0 | I2: 5.73 | K2: 1 | M2: 0 | O2: 0 | Q2: 0 | S2: 0 | U2: 0 | W2: 1.1 | Y2: 1 | AA2: 0 | AC2: 0 | AE2: 0 | AG2: 0 | AI2: 2
A3: JUL 23 | C3: ANA | E3: 1 | G3: 0 | I3: 4.61 | K3: 1 | M3: 0 | O3: 0 | Q3: 0 | S3: 0 | U3: 0 | W3: 2.2 | Y3: 1 | AA3: 0 | AC3: 0 | AE3: 0 | AG3: 1 | AI3: 3
A4: JUL 25 | C4: @SEA | E4: 0 | G4: 0 | I4: 4.80 | K4: 1 | M4: 0 | O4: 0 | Q4: 0 | S4: 0 | U4: 0 | W4: 1.1 | Y4: 2 | AA4: 1 | AC4: 1 | AE4: 0 | AG4: 1 | AI4: 1
A5: JUL 29 | C5: BOS | E5: 0 | G5: 0 | I5: 4.96 | K5: 1 | M5: 0 | O5: 0 | Q5: 0 | S5: 0 | U5: 0 | W5: 1.1 | Y5: 1 | AA5: 1 | AC5: 1 | AE5: 0 | AG5: 0 | AI5: 0
A6: JUL 31 | C6: BOS | E6: 1 | G6: 0 | I6: 4.67 | K6: 1 | M6: 0 | O6: 0 | Q6: 0 | S6: 0 | U6: 0 | W6: 1.0 | Y6: 2 | AA6: 0 | AC6: 0 | AE6: 0 | AG6: 0 | AI6: 1
A8: July Total: | E8: 2 | G8: 0 | I8: 2.35 | K8: 5 | M8: 0 | O8: 0 | Q8: 0 | S8: 0 | U8: 0 | W8: 7.2 | Y8: 7 | AA8: 2 | AC8: 2 | AE8: 0 | AG8: 2 | AI8: 7

A3: DATE | C3: GAME | E3: W | G3: L | I3: ERA | K3: G | M3: GS | O3: CG | Q3: SHO | S3: SV | U3: SVO | W3: IP | Y3: H | AA3: R | AC3: ER | AE3: HR | AG3: BB | AI3: SO
A4: AUG 02 | C4: CLE | E4: 1 | G4: 0 | I4: 4.34 | K4: 1 | M4: 0 | O4: 0 | Q4: 0 | S4: 0 | U4: 0 | W4: 1.1 | Y4: 0 | AA4: 0 | AC4: 0 | AE4: 0 | AG4: 0 | AI4: 0
A5: AUG 05 | C5: @NYA | E5: 0 | G5: 0 | I5: 4.05 | K5: 1 | M5: 0 | O5: 0 | Q5: 0 | S5: 0 | U5: 0 | W5: 1.1 | Y5: 0 | AA5: 0 | AC5: 0 | AE5: 0 | AG5: 0 | AI5: 0
A6: AUG 07 | C6: @NYA | E6: 0 | G6: 0 | I6: 3.74 | K6: 1 | M6: 0 | O6: 0 | Q6: 0 | S6: 0 | U6: 0 | W6: 1.2 | Y6: 0 | AA6: 0 | AC6: 0 | AE6: 0 | AG6: 1 | AI6: 1
A7: AUG 09 | C7: @TOR | E7: 0 | G7: 0 | I7: 3.47 | K7: 1 | M7: 0 | O7: 0 | Q7: 0 | S7: 0 | U7: 0 | W7: 1.2 | Y7: 0 | AA7: 0 | AC7: 0 | AE7: 0 | AG7: 1 | AI7: 1
A8: AUG 12 | C8: DET | E8: 0 | G8: 0 | I8: 3.08 | K8: 1 | M8: 0 | O8: 0 | Q8: 0 | S8: 0 | U8: 0 | W8: 3.0 | Y8: 0 | AA8: 0 | AC8: 0 | AE8: 0 | AG8: 0 | AI8: 3
A9: AUG 16 | C9: CHA | E9: 0 | G9: 0 | I9: 2.79 | K9: 1 | M9: 0 | O9: 0 | Q9: 0 | S9: 0 | U9: 0 | W9: 2.2 | Y9: 2 | AA9: 0 | AC9: 0 | AE9: 0 | AG9: 0 | AI9: 0
A11: August Total: | E11: 1 | G11: 0 | I11: 0.00 | K11: 6 | M11: 0 | O11: 0 | Q11: 0 | S11: 0 | U11: 0 | W11: 11.2 | Y11: 2 | AA11: 0 | AC11: 0 | AE11: 0 | AG11: 2 | AI11: 5