B1: Texas Rangers

A1: Player | B1: G | C1: AB | D1: R | E1: H | F1: 2B | G1: 3B | H1: HR | I1: RBI | J1: TB | K1: BB | L1: SO | M1: SB | N1: CS | O1: OBP | P1: SLG | Q1: OPS
A2: M Young | B2: 6 | C2: 27 | D2: 1 | E2: 3 | F2: 1 | G2: 0 | H2: 0 | I2: 1 | J2: 4 | K2: 1 | L2: 5 | M2: 1 | N2: 0 | O2: 0.14299999999999999 | P2: 0.14799999999999999 | Q2: =O2+P2 -> 0.29099999999999998
A3: A Rodriguez | B3: 6 | C3: 24 | D3: 4 | E3: 8 | F3: 2 | G3: 0 | H3: 2 | I3: 5 | J3: 16 | K3: 2 | L3: 2 | M3: 0 | N3: 0 | O3: 0.40699999999999997 | P3: 0.66700000000000004 | Q3: =O3+P3 -> 1.0740000000000001
A4: M Teixeira | B4: 6 | C4: 23 | D4: 1 | E4: 7 | F4: 2 | G4: 0 | H4: 0 | I4: 2 | J4: 9 | K4: 2 | L4: 8 | M4: 0 | N4: 0 | O4: 0.38500000000000001 | P4: 0.39100000000000001 | Q4: =O4+P4 -> 0.77600000000000002
A5: K Mench | B5: 5 | C5: 21 | D5: 3 | E5: 8 | F5: 2 | G5: 0 | H5: 0 | I5: 0 | J5: 10 | K5: 1 | L5: 1 | M5: 0 | N5: 0 | O5: 0.40899999999999997 | P5: 0.47599999999999998 | Q5: =O5+P5 -> 0.88500000000000001
A6: C Everett | B6: 6 | C6: 19 | D6: 2 | E6: 3 | F6: 0 | G6: 0 | H6: 1 | I6: 3 | J6: 6 | K6: 1 | L6: 4 | M6: 0 | N6: 0 | O6: 0.190 | P6: 0.316 | Q6: =O6+P6 -> 0.50600000000000001
A7: H Blalock | B7: 5 | C7: 18 | D7: 2 | E7: 6 | F7: 3 | G7: 0 | H7: 1 | I7: 2 | J7: 12 | K7: 1 | L7: 2 | M7: 0 | N7: 0 | O7: 0.36799999999999999 | P7: 0.66700000000000004 | Q7: =O7+P7 -> 1.0349999999999999
A8: R Palmeiro | B8: 5 | C8: 18 | D8: 3 | E8: 3 | F8: 0 | G8: 0 | H8: 1 | I8: 3 | J8: 6 | K8: 3 | L8: 2 | M8: 0 | N8: 0 | O8: 0.28599999999999998 | P8: 0.33300000000000002 | Q8: =O8+P8 -> 0.61899999999999999
A9: E Diaz | B9: 4 | C9: 15 | D9: 0 | E9: 3 | F9: 1 | G9: 0 | H9: 0 | I9: 0 | J9: 4 | K9: 1 | L9: 3 | M9: 0 | N9: 0 | O9: 0.250 | P9: 0.26700000000000002 | Q9: =O9+P9 -> 0.51700000000000002
A10: D Glanville | B10: 4 | C10: 15 | D10: 2 | E10: 4 | F10: 0 | G10: 0 | H10: 0 | I10: 1 | J10: 4 | K10: 1 | L10: 2 | M10: 0 | N10: 0 | O10: 0.313 | P10: 0.26700000000000002 | Q10: =O10+P10 -> 0.580
A11: D Sadler | B11: 4 | C11: 15 | D11: 1 | E11: 3 | F11: 0 | G11: 0 | H11: 0 | I11: 1 | J11: 3 | K11: 0 | L11: 2 | M11: 0 | N11: 0 | O11: 0.188 | P11: 0.200 | Q11: =O11+P11 -> 0.38800000000000001
A12: J Gonzalez | B12: 3 | C12: 13 | D12: 1 | E12: 3 | F12: 1 | G12: 1 | H12: 0 | I12: 1 | J12: 6 | K12: 0 | L12: 2 | M12: 0 | N12: 0 | O12: 0.23100000000000001 | P12: 0.46200000000000002 | Q12: =O12+P12 -> 0.69300000000000006
A13: T Greene | B13: 2 | C13: 8 | D13: 0 | E13: 2 | F13: 0 | G13: 0 | H13: 0 | I13: 0 | J13: 2 | K13: 0 | L13: 0 | M13: 0 | N13: 0 | O13: 0.250 | P13: 0.250 | Q13: =O13+P13 -> 0.500
A14: M Lamb | B14: 3 | C14: 2 | D14: 0 | E14: 1 | F14: 0 | G14: 0 | H14: 0 | I14: 0 | J14: 1 | K14: 0 | L14: 0 | M14: 0 | N14: 0 | O14: 0.500 | P14: 0.500 | Q14: =O14+P14 -> 1.000

A1: Player | B1: W | C1: L | D1: ERA | E1: G | F1: SV | G1: IP | H1: H | I1: R | J1: ER | K1: HR | L1: BB | M1: SO | N1: TB | O1: OBA | P1: SLG | Q1: OPS
A2: J Thomson | B2: 0 | C2: 2 | D2: 10.13 | E2: 2 | F2: 0 | G2: 10.2 | H2: 18 | I2: 12 | J2: 12 | K2: 1 | L2: 2 | M2: 5 | N2: 28 | O2: 0.40799999999999997 | P2: 0.59599999999999997 | Q2: =O2+P2 -> 1.004
A3: V Santos | B3: 0 | C3: 1 | D3: 6.00 | E3: 2 | F3: 0 | G3: 6 | H3: 7 | I3: 5 | J3: 4 | K3: 3 | L3: 1 | M3: 3 | N3: 17 | O3: 0.34799999999999998 | P3: 0.77300000000000002 | Q3: =O3+P3 -> 1.121
A4: T Mounce | B4: 0 | C4: 0 | D4: 1.59 | E4: 1 | F4: 0 | G4: 5.2 | H4: 4 | I4: 1 | J4: 1 | K4: 0 | L4: 2 | M4: 3 | N4: 5 | O4: 0.27300000000000002 | P4: 0.250 | Q4: =O4+P4 -> 0.52300000000000002
A5: I Valdes | B5: 0 | C5: 1 | D5: 18.00 | E5: 1 | F5: 0 | G5: 4 | H5: 10 | I5: 8 | J5: 8 | K5: 2 | L5: 0 | M5: 1 | N5: 19 | O5: 0.47799999999999998 | P5: 0.90500000000000003 | Q5: =O5+P5 -> 1.383
A6: F Cordero | B6: 0 | C6: 0 | D6: 4.91 | E6: 3 | F6: 0 | G6: 3.2 | H6: 4 | I6: 2 | J6: 2 | K6: 1 | L6: 1 | M6: 2 | N6: 8 | O6: 0.35299999999999998 | P6: 0.53300000000000003 | Q6: =O6+P6 -> 0.88600000000000001
A7: J Powell | B7: 0 | C7: 0 | D7: 4.91 | E7: 2 | F7: 0 | G7: 3.2 | H7: 5 | I7: 2 | J7: 2 | K7: 1 | L7: 4 | M7: 4 | N7: 8 | O7: 0.47399999999999998 | P7: 0.53300000000000003 | Q7: =O7+P7 -> 1.0070000000000001
A8: E Ramirez | B8: 0 | C8: 0 | D8: 9.82 | E8: 3 | F8: 0 | G8: 3.2 | H8: 5 | I8: 4 | J8: 4 | K8: 1 | L8: 0 | M8: 2 | N8: 9 | O8: 0.33300000000000002 | P8: 0.52900000000000003 | Q8: =O8+P8 -> 0.8620000000000001
A9: M Ramos | B9: 0 | C9: 1 | D9: 9.82 | E9: 1 | F9: 0 | G9: 3.2 | H9: 5 | I9: 4 | J9: 4 | K9: 2 | L9: 4 | M9: 4 | N9: 11 | O9: 0.42899999999999999 | P9: 0.64700000000000002 | Q9: =O9+P9 -> 1.0760000000000001
A10: B Shouse | B10: 0 | C10: 0 | D10: 0.00 | E10: 2 | F10: 0 | G10: 3.2 | H10: 1 | I10: 0 | J10: 0 | K10: 0 | L10: 1 | M10: 1 | N10: 2 | O10: 0.154 | P10: 0.16700000000000001 | Q10: =O10+P10 -> 0.32100000000000001
A11: U Urbina | B11: 0 | C11: 0 | D11: 3.00 | E11: 2 | F11: 0 | G11: 3 | H11: 1 | I11: 1 | J11: 1 | K11: 0 | L11: 2 | M11: 3 | N11: 1 | O11: 0.27300000000000002 | P11: 0.125 | Q11: =O11+P11 -> 0.39800000000000002
A12: R Dickey | B12: 0 | C12: 1 | D12: 10.12 | E12: 2 | F12: 0 | G12: 2.2 | H12: 6 | I12: 3 | J12: 3 | K12: 1 | L12: 4 | M12: 1 | N12: 9 | O12: 0.625 | P12: 0.750 | Q12: =O12+P12 -> 1.375
A13: R Garcia | B13: 0 | C13: 0 | D13: 0.00 | E13: 3 | F13: 0 | G13: 2.1 | H13: 2 | I13: 0 | J13: 0 | K13: 0 | L13: 0 | M13: 1 | N13: 2 | O13: 0.222 | P13: 0.222 | Q13: =O13+P13 -> 0.44400000000000001
A14: A Fultz | B14: 0 | C14: 0 | D14: 54.00 | E14: 2 | F14: 0 | G14: 1 | H14: 6 | I14: 6 | J14: 6 | K14: 0 | L14: 1 | M14: 1 | N14: 6 | O14: 0.77800000000000002 | P14: 0.750 | Q14: =O14+P14 -> 1.528

A1: TIME PERIOD | B1: AB | C1: H | D1: BB | E1: TB | F1: HR | G1: HBP | H1: BA | I1: OBA | J1: SLG | K1: OPS
A2: THRU 17 MAY | B2: 139 | C2: 46 | D2: 19 | E2: 98 | F2: 13 | G2: 5 | H2: .331 | I2: .411 | J2: .705 | K2: 1.116
A3: AFTER 17 MAY | B3: 104 | C3: 22 | D3: 8 | E3: 38 | F3: 4 | G3: 0 | H3: .212 | I3: .267 | J3: .365 | K3: .633