B1: Last 10 | D1: Season | F1: Home | H1: Road | J1: Road Pct
A2: ALE | B2: =SUM(B13:B17) -> 28 | C2: =SUM(C13:C17) -> 21 | D2: =SUM(D13:D17) -> 60 | E2: =SUM(E13:E17) -> 53 | F2: =SUM(F13:F17) -> 32 | G2: =SUM(G13:G17) -> 19 | H2: =SUM(H13:H17) -> 28 | I2: =SUM(I13:I17) -> 34 | J2: =H2/(H2+I2) -> 0.45161290322580644
A3: ALC | B3: =SUM(B20:B24) -> 25 | C3: =SUM(C20:C24) -> 25 | D3: =SUM(D20:D24) -> 57 | E3: =SUM(E20:E24) -> 58 | F3: =SUM(F20:F24) -> 31 | G3: =SUM(G20:G24) -> 22 | H3: =SUM(H20:H24) -> 26 | I3: =SUM(I20:I24) -> 36 | J3: =H3/(H3+I3) -> 0.41935483870967744
A4: ALW | B4: =SUM(B27:B30) -> 16 | C4: =SUM(C27:C30) -> 24 | D4: =SUM(D27:D30) -> 44 | E4: =SUM(E27:E30) -> 50 | F4: =SUM(F27:F30) -> 27 | G4: =SUM(G27:G30) -> 31 | H4: =SUM(H27:H30) -> 17 | I4: =SUM(I27:I30) -> 19 | J4: =H4/(H4+I4) -> 0.47222222222222221
A6: NLE
A7: NLC
A8: NLW
A12: ALE
A13: Tor | B13: 7 | C13: 3 | D13: 12 | E13: 13 | F13: 7 | G13: 7 | H13: 5 | I13: 6 | J13: =H13/(H13+I13) -> 0.45454545454545453
A14: Balt | B14: 6 | C14: 4 | D14: 14 | E14: 9 | F14: 9 | G14: 1 | H14: 5 | I14: 8 | J14: =H14/(H14+I14) -> 0.38461538461538464
A15: Bos | B15: 6 | C15: 4 | D15: 11 | E15: 9 | F15: 5 | G15: 2 | H15: 6 | I15: 7 | J15: =H15/(H15+I15) -> 0.46153846153846156
A16: NYY | B16: 5 | C16: 5 | D16: 14 | E16: 8 | F16: 7 | G16: 3 | H16: 7 | I16: 5 | J16: =H16/(H16+I16) -> 0.58333333333333337
A17: TB | B17: 4 | C17: 5 | D17: 9 | E17: 14 | F17: 4 | G17: 6 | H17: 5 | I17: 8 | J17: =H17/(H17+I17) -> 0.38461538461538464
A19: ALC
A20: CWS | B20: 9 | C20: 1 | D20: 17 | E20: 7 | F20: 9 | G20: 3 | H20: 8 | I20: 4 | J20: =H20/(H20+I20) -> 0.66666666666666663
A21: Clev | B21: 6 | C21: 4 | D21: 13 | E21: 7 | F21: 4 | G21: 4 | H21: 9 | I21: 3 | J21: =H21/(H21+I21) -> 0.75
A22: Minn | B22: 6 | C22: 4 | D22: 11 | E22: 14 | F22: 6 | G22: 6 | H22: 5 | I22: 8 | J22: =H22/(H22+I22) -> 0.38461538461538464
A23: KC | B23: 3 | C23: 7 | D23: 11 | E23: 13 | F23: 9 | G23: 2 | H23: 2 | I23: 11 | J23: =H23/(H23+I23) -> 0.15384615384615385
A24: Det | B24: 1 | C24: 9 | D24: 5 | E24: 17 | F24: 3 | G24: 7 | H24: 2 | I24: 10 | J24: =H24/(H24+I24) -> 0.16666666666666666
A26: ALW
A27: Sea | B27: 5 | C27: 5 | D27: 13 | E27: 9 | F27: 8 | G27: 4 | H27: 5 | I27: 5 | J27: =H27/(H27+I27) -> 0.5
A28: Ana | B28: 4 | C28: 6 | D28: 12 | E28: 13 | F28: 8 | G28: 7 | H28: 4 | I28: 6 | J28: =H28/(H28+I28) -> 00.4
A29: Oak | B29: 5 | C29: 5 | D29: 11 | E29: 13 | F29: 5 | G29: 10 | H29: 6 | I29: 3 | J29: =H29/(H29+I29) -> 0.66666666666666663
A30: Tex | B30: 2 | C30: 8 | D30: 8 | E30: 15 | F30: 6 | G30: 10 | H30: 2 | I30: 5 | J30: =H30/(H30+I30) -> 0.2857142857142857